[
  {
    "id": "economico",
    "nombre": "Eje económico",
    "poloNegativo": "Izquierda económica (redistribución, intervención estatal)",
    "poloPositivo": "Derecha económica (mercado, baja fiscalidad)",
    "descripcion": "Impuestos, gasto social, regulación laboral, papel del Estado en la economía."
  },
  {
    "id": "social",
    "nombre": "Eje social/cultural (GAL–TAN)",
    "poloNegativo": "Verde/Alternativo/Libertario (GAL)",
    "poloPositivo": "Tradicional/Autoritario/Nacionalista (TAN)",
    "descripcion": "Inmigración, derechos LGTB, orden público, moral pública. Segunda dimensión del CHES."
  },
  {
    "id": "territorial",
    "nombre": "Eje territorial",
    "poloNegativo": "Máxima descentralización, incluido derecho a decidir",
    "poloPositivo": "Máxima centralización estatal",
    "descripcion": "El eje distintivo del sistema de partidos español, ortogonal al izquierda-derecha."
  },
  {
    "id": "ue",
    "nombre": "Integración europea",
    "poloNegativo": "Europeísmo (más integración)",
    "poloPositivo": "Euroescepticismo (menos integración)",
    "descripcion": "Cesión de soberanía, normativa europea, ampliación."
  },
  {
    "id": "ecologia",
    "nombre": "Ecologismo",
    "poloNegativo": "Productivismo (crecimiento primero)",
    "poloPositivo": "Ecologismo (transición ambiental primero)",
    "descripcion": "Transición energética, protección ambiental frente a coste económico."
  },
  {
    "id": "populismo",
    "nombre": "Populismo",
    "poloNegativo": "Pluralismo institucional",
    "poloPositivo": "Antielitismo (pueblo frente a élites)",
    "descripcion": "Actitud hacia élites, instituciones y mediación política."
  },
  {
    "id": "metodo-cambio",
    "nombre": "Método de cambio (izquierda)",
    "poloNegativo": "Reformismo gradual",
    "poloPositivo": "Ruptura revolucionaria",
    "descripcion": "Sub-eje del módulo de corrientes de la izquierda.",
    "subEje": true
  },
  {
    "id": "organizacion",
    "nombre": "Modelo organizativo (izquierda)",
    "poloNegativo": "Horizontalismo, consejos y asambleas",
    "poloPositivo": "Vanguardismo, partido dirigente",
    "descripcion": "Sub-eje que separa leninismo/estalinismo/maoísmo de luxemburguismo, consejismo y anarcocomunismo.",
    "subEje": true
  },
  {
    "id": "tradicion-moral",
    "nombre": "Moral pública (derecha)",
    "poloNegativo": "Libertario en costumbres (línea liberal / pro-LGTB)",
    "poloPositivo": "Tradicionalismo moral (derecha confesional)",
    "descripcion": "Sub-eje que separa la derecha liberal en costumbres de la derecha cristiana/tradicionalista.",
    "subEje": true
  },
  {
    "id": "internacionalismo",
    "nombre": "Internacionalismo",
    "poloNegativo": "Internacionalismo (la estrategia y la solidaridad no tienen fronteras)",
    "poloPositivo": "Soberanismo (la nación primero)",
    "descripcion": "Sub-eje transversal: separa el internacionalismo (comunista clásico, europeísta federal) del socialismo en un país, el rojipardismo y los soberanismos.",
    "subEje": true
  },
  {
    "id": "monarquia",
    "nombre": "Forma de la jefatura del Estado",
    "poloNegativo": "República",
    "poloPositivo": "Monarquía",
    "descripcion": "Sub-eje transversal: republicanos hay en la izquierda, el falangismo y parte del liberalismo; la monarquía une a PP, VOX y sector del PSOE. Corta las familias por dentro.",
    "subEje": true
  },
  {
    "id": "atlantismo",
    "nombre": "Defensa y OTAN",
    "poloNegativo": "Antimilitarismo (salida de la OTAN, menos gasto militar)",
    "poloPositivo": "Atlantismo (permanencia en la OTAN, más gasto en defensa)",
    "descripcion": "Sub-eje transversal: separa PSOE de Podemos, VOX de la Falange, y al pacifismo de casi todo el mundo.",
    "subEje": true
  },
  {
    "id": "laicismo",
    "nombre": "Religión y Estado",
    "poloNegativo": "Laicismo estricto (denuncia del Concordato, sin religión en lo público)",
    "poloPositivo": "Confesionalismo (presencia pública de la religión, acuerdos Iglesia-Estado)",
    "descripcion": "Sub-eje transversal: separa el laicismo (IE, sector PSOE, izquierda) de la aconfesionalidad práctica (PP) y del nacional-catolicismo.",
    "subEje": true
  },
  {
    "id": "animalismo",
    "nombre": "Estatus de los animales",
    "poloNegativo": "Primacía de usos humanos y tradiciones (caza, toros, ganadería)",
    "poloPositivo": "Derechos de los animales como sujetos",
    "descripcion": "Sub-eje del módulo verde-animalista: separa el animalismo de derechos (PACMA) del bienestarismo regulador y del agrarismo tradicional.",
    "subEje": true
  }
]
